Title,Price,Original Price,Description,OpenCart Versions,Demo Link,Admin Demo Link,Source URL
Product Option Model,N/A,N/A,"TMD is an Offical Partner of OpenCartView Profile:TMD OpenCart Extensions IndiaOverview of TMD OpenCart Product Option ModelThis extension is designed exclusively for those ecommerce websites having products with multiple variants or options.It will let the business owner show the model name of each option of the item. The model name will display just after the option on the product page.Reading the model name of the product option makes the customer aware throughout the order process and can verify the product when it arrived at their location. Also, The stock management of the products will be easy. Thus, this module will help both customers and businesses.Supported Options AreThis option model module supports various types of options,ensuring that it aligns perfectly with your specific needs. Select, checkbox, and radio buttons are the most common and used option types in ecommerce websites.These options are supported by this extension in the OpenCart website.1. Select (Drop-Down)2. Checkbox3. Radio ButtonsAdding Model Name To Product Options In OpenCartIt is fairly easy to add the model name in the product options using this module. There are only two steps involved. First, go to the setting of the option module extension. select the status enable and write the identifier. For example ""MODEL"". It will appear before the model name of the product option.Now,Go to the product list → edit the product → select the options tab → search the option type from these three select, radio, checkbox. Write the model name in the options section. Hit the save button.Follow the same process for other products.Checking Option Model on Product PageNavigate to the product page. Check the options list. Individual option names are appended with the model name in the round brackets. There will be no changes in the design while appending the model name with an identifier in the options.The model name has the same text color as the option as the module uses the website color theme to maintain the branding. It displays perfectly across all devices, whether it’s a desktop, tab or mobile.Working With Most OpenCart ThemesThe unit test has been performed with multiple themes to ensure you will get the working extension on your website.Here are some names of themes in which the module is tested Journal, Shoppica, Poco, Sellegance, Fastor, Pavilion, BigShop, eMarket, etc.This extension will automatically insert the model name into the product's options  no matter what OpenCart theme you are using.Compatible With Multiple OpenCart VersionsTMD made the OpenCart option model name module compatible with multiple versions of the OpenCart. You will always find it compatible with the latest version of OpenCart.Our extension is compatible with  2x, 3x, and 4x versions.You can follow the official installation process to install this extension on your website.Effortless InstallationThe installation of this module is easy and similar to other OpenCart extensions. Go with the extension installer or upload the module files on the server manually. Follow the easiest method for you. Your website files remain untouched while and after the installation of the extension.Follow the online documentation for installation and setting. You will find the documentation link in the document tab or just ask the support team they will do it for you.SupportIf you require assistance with website development, and customization, or need support with the OpenCart extensions installation and setup, please create a ticket. Our dedicated team is available to provide the professional help you need.","3.0.3.8, 3.0.3.7, 3.0.3.6, 3.0.3.2, 3.0.2.1 (Beta), 3.0.2.0 4.0.2.3, 4.0.2.2, 4.0.2.1, 4.0.2.0, 4.0.1.1, 4.0.1.0, 4.1.0.0, 4.1.0.1, 4.1.0.2, 4.1.0.3 2.2.0.0 2.1.0.2, 2.1.0.1, 2.0.3.1, 2.0.2.0, 2.0.1.1, 2.0.1.0 2.3.0.2, 2.3.0.1, 2.3.0.0",https://www.demoopencart.in/productoptionmodel/oc3/index.php?route=product/product&product_id=30,https://www.demoopencart.in/productoptionmodel/oc3/admin/index.php?route=extension/module/tmd_model&user_token=XNlAYdMgA2FMvINdrnV44jLYMLcHMNbd,https://www.opencartextensions.in/opencart-modules/product-option-model
Product Option SKU,$28.49,$29.99,"TMD is an Official Partner of OpenCartView Profile:TMD OpenCart Extensions IndiaOverview Of TMD Opencart Product Option SKUThe perfect extension for those who want to easily manage and assign different SKUs for each product option.With this module, you'll have the ability to assign unique SKUs for each option of your product, making it easier to manage and track your inventory.This powerful module is easy to install and use, and it seamlessly integrates into your OpenCart store. Once installed, an SKU section will be automatically added to the product page, giving you the ability to assign a unique SKU for each product option.Opencart Option SKU: Exclusive and On-Demand featuresAssign Unique SKUs for Each Product OptionWith this module, Admin will assign a unique SKU for each product option. This feature allows you to easily manage and track your inventory for each product option, ensuring that you have the correct stock levels for your products.An SKU field will automatically be added to the options tab of the product beside every option admin is going to create for the product. Admin can write the SKU for that option.Enjoy Instant Automatic SKU Section with OpenCart Product Option SKU Extension for AdminAfter installing the OpenCart Product Option SKU module, an SKU section will be automatically added to the product page. This feature eliminates the need for manual SKU input, saving you time and effort.Showcase Your Inventory with Ease: Display SKU on Multiple Pages with OpenCart Option SKU ExtensionSKUs assigned to each product option can be seen on various pages such as the Product Page, Header Cart, Cart Page, Checkout Page, Order Page, and Invoice Page. This feature will ensure that you have a seamless and efficient order processing system.Seamless Integration for Your OpenCart Store: Compatible with Both OpenCart 2x and 3x VersionsThe OpenCart Product Option SKU module is compatible with OpenCart 2x and 3x versions. This feature means that you can easily integrate the module into your OpenCart store, regardless of the version you're using.Working With Almost all OpenCart ThemesThe OpenCart Option SKU module is also compatible with almost all themes. This feature ensures that you can integrate the module into your OpenCart store without any issues, regardless of the theme you're using.Customizable SKU Formats for Your Business NeedsThe OpenCart Product Option SKU module allows store owners to assign unique SKUs for each product option in various formats, such as alphanumeric or numeric. This flexibility ensures that store owners can choose the format that works best for their business.Reach a Global Audience with Multilingual SupportThe OpenCart Product Option SKU module supports multiple languages, making it an ideal solution for businesses that operate in multiple countries or regions. This feature allows store owners to assign SKUs in different languages, ensuring that the correct SKU is associated with each product option in each language.Frequently Asked QuestionsQ. Can I assign multiple SKUs to a single product option?Ans: Yes, with the OpenCart Product Option SKU module, you can assign different SKUs to each product option. This allows for more detailed tracking and inventory management.Q. Will the module work with my custom OpenCart theme?Ans: The OpenCart Option SKU module is designed to be compatible with almost all OpenCart themes, including custom themes. If you do encounter any issues, the developer provides support to ensure the module works correctly with your theme.For Any Query Feel Free To Contact Us:Our all customers are happy with us because we provide the best free support. For any questions, suggestion feel free to contact us at. Got pre-sale questions or have support questions? Please create a ticket. We will help you to get it working.","3.0.4.0, 3.0.3.9, 3.0.3.8, 3.0.3.7, 3.0.3.6, 3.0.3.2, 3.0.3.1, 3.0.2.1 (Beta), 3.0.2.0, 3.0.4.1 2.3.0.2, 2.3.0.1, 2.3.0.0 2.1.0.2, 2.1.0.1, 2.0.3.1, 2.0.1.1 2.2.0.0 4.0.2.3, 4.0.2.2, 4.0.2.1, 4.0.2.0, 4.0.1.1, 4.0.1.0, 4.0.0.0, 4.1.0.0, 4.1.0.1, 4.1.0.2, 4.1.0.3",https://www.demoopencart.in/productoptionsku/oc3/index.php?route=common/home,https://www.demoopencart.in/productoptionsku/oc3/admin/index.php?route=extension/module/tmd_sku&user_token=tjaZAk5B6nBGJaICYxCYNjlfTy52bTmq,https://www.opencartextensions.in/opencart-modules/product-option-sKU
Product Option SKU UPC,$28.49,$29.99,"TMD is an Offical Partner of OpenCartView Profile:TMD OpenCart Extensions IndiaTMD OpenCart Product Option SKU and UPC ModuleSKU and UPC are important information on the product and must be shown on the product page. This module lets you show this information to product Options too. Some time product option has different-different SKU and UPC.It helps the website track the product inventory and order shipping. Admin can enter UPC and SKU with options while creating product options. Easy to use and work with all OpenCart themes.This SKU and UPC will display everywhere from Order invoice or checkout, cart page, and small cart popup too. It also shows on the order information. This way customer knows which item they have bought and tracking inventory also makes it easy.Assign SKU and UPC To OpenCart Product Optionit uses built-in OpenCart designs. The setting is too easy and the admin can enter information fairly easily. All this information will be shown on the front end. Here is the process of working.✔It creates two new fields in the product options section called. SKU and UPC✔Admin will enter universal product code in the UPC field and  Stock keeping unit information into SKU respectively.✔SKU and UPC information will show with a product with an option name. It does not require additional work.✔From the setting, you can enable and disable the SKU and UPC code for all products.✔Works with all kinds of product options.✔Automatically attach with product option and show on the front end.Configure OpenCart Product Option SKU and UPC ExtensionAdmin can configure the module from the setting. Doing setting convenient for the website, theadmin can always enable UPC or SKU as website requirements. Either SKU enabled at a time or SKU. If needed, both will enable at the same time.The front end will show information according to the setting done by the admin.Admin has also an option to disable both of them. From setting disabling SKU and UPC will hide everywhere. It will also hide the SKU and UPC from the product options section.This module also lets the admin change the label of SKU and UPC. Let the admin show a new label.This label will be replaced with SKU and UPC on the front end of the product option. Customers will see a newly replaced label.Like other modules, it also consists of a global status option with enabling and disables. Enabling the status from the setting will activate this extension and show all the rest settings in admin and enable into the front end.Automatically Show On Every Page Of The FrontendMODULE NAME automatically attaches SKU and UPC to the OpenCart product option name. Hence it displays the product option name.SKU and UPC attached with product option will display every place where every option is displayed.Admin does not need to do any work to display it on the front end. This work is managed by the module. Customers will read SKU and UPC to checkout and order pages respectively. Here is a list of the page where product options display it✔Product Page✔Cart Popup✔Cart Page✔Checkout Page ( if products show there )✔Order Invoice✔Order information pageNote: You can check the screenshot, and how it will display on all pages.Supports OpenCart 1.5.x, 2.x and 3.x VersionsTMD used OCMOD and VQMOD to create OpenCart and attach SKU and UPC to product options.It works perfectly on the 2.0.x and  3.0.x versions of OpenCart.It is also tested up to the latest stable version 3.0.3.3.For those who still using an older version of OpenCart, TMD maintains a 1.5.x version of this extension. Just because of their comfort. We value all website and their businesses.It is tested on the cloud version to give the best performance on the cloud-based website. Testing has been done using the Unit test to deliver quality work.There will no core file will alter after installation of the opencart shows UPSC on the product page on your website. It uses OCMOD and VQMOD.It virtually creates a file system and adds compatibility to files on runtime.Your website files will remain the same and untouched after the installation of all TMD OpenCart modules and extensions. The website will remain to function as before it does. It is easy to use right? Yeah!SupportGot pre-sale questions or have questions about support? Please create a ticket. We will help you to get it working.","2.2.0.0 2.3.0.2, 2.3.0.1, 2.3.0.0 2.1.0.2, 2.1.0.1, 2.0.3.1, 2.0.2.0, 2.0.1.1, 2.0.1.0 3.0.4.0, 3.0.3.9, 3.0.3.8, 3.0.3.7, 3.0.3.6, 3.0.3.2, 3.0.3.1, 3.0.3.0, 3.0.2.0, 3.0.1.2, 3.0.1.1, 3.0.0.0 4.0.2.3, 4.0.2.2, 4.0.2.1, 4.0.2.0, 4.0.1.1, 4.0.1.0, 4.0.0.0, 4.1.0.0, 4.1.0.1, 4.1.0.2, 4.1.0.3",https://www.demoopencart.in/productoptionskuupc/oc3/index.php?route=common/home,https://www.demoopencart.in/productoptionskuupc/oc3/admin/index.php?route=extension/module/tmd_skuupc&user_token=xS2odFUjo2C17M6s2nH8BVnlwSBBK154,https://www.opencartextensions.in/opencart-modules/product-option-sku-upc
Product Option Sub Image,$28.49,$29.99,"TMD is an Official Partner of OpenCartView Profile:TMD OpenCart Extensions IndiaOverview Of TMD OpenCart Product Option Sub Image ModuleIt is one of the essential features of the ecommerce website to give a better view of the product. This extension creates a new section for uploading multiple images for the option. This extension is very helpful when a product has multiple options like color, fabric, designs, etc. Admin can upload multiple images according to a single option.This way when a customer lands on products to see product images of the selected option, They will get only selected option images only.It helps customers to visualize the product quality before making a purchase online. with this module, the product will show options with images and sub-images of options.Add Multiple Images For Product Option From SettingOpenCart Product option module very easy to add multiple images.In the options tab, select the color option, which shows the images upload section. Admin can click on the plus button to add an image for the selected option. For example, the red color option adds a red color product image only and the yellow color option has only a yellow-colored product image.Admin can give one specific image that represents the color of the option. This image will be displayed in the options section on the product page. This way option colors will be differentiated from each other. Admin can add and remove sub-images from the option.Add Color imageAdd or Remove option images from the option tabOption Multiple Images On The Product PageAfter adding the images for the option, visitors can see the updated product page. Selecting the option shows the images of that option. The current product image is replaced with the selected option and other images are also replaced.Now visitors/customers can see the options images in large view. Product price is also changed accordingly.Automatically changes images of the product according to the selection of optionReplace the current product image with the option image.Sub-images are also replaced with selected option imagesSupports OpenCart2.x and 3.x VersionsTMD used OCMOD and VQMOD to create OpenCart Product color option multiple image extension.It works perfectly on 2.0.x and  3.0.x versions of OpenCart.It is also tested up to the latest stable version.It is tested on the cloud version to give the best performance. Testing has been done using the Unit test to give quality to work.There will be no core file that will alter after installation of the introduction message to visitors in OpenCart into your website.It virtually creates a file system and adds compatibility to files on runtime.Your website files will remain the same and untouched after the installation of TMD OpenCart modules. The website will remain to function as before it does. It is easy to use right? Yeah!SupportIf you have any kind of questions or looking for support. Please create a ticket.","3.0.3.8, 3.0.3.7, 3.0.3.6, 3.0.3.2, 3.0.3.1, 3.0.3.0, 3.0.2.0, 3.0.1.2, 3.0.1.1, 3.0.0.0 2.3.0.2, 2.3.0.1, 2.3.0.0 4.0.2.3, 4.0.2.2, 4.0.2.1, 4.0.2.0, 4.0.1.1, 4.0.1.0 3.0.3.9, 3.0.4.0",https://www.demoopencart.in/productoptionsubimage/oc3/index.php?route=product/product&product_id=30,https://www.demoopencart.in/productoptionsubimage/oc3/admin/index.php?route=marketplace/extension,https://www.opencartextensions.in/opencart-modules/product-option-sub-image
