Title,Price,Original Price,Description,OpenCart Versions,Demo Link,Admin Demo Link,Source URL
"RoundAbout (Carousel) (1.5.x , 2.x & 3.x)",$28.49,$29.99,"TMD is an Offical Partner of OpenCartView Profile:TMD OpenCart Extensions IndiaOverview of TMD OpenCart RoundAbout SliderThe OpenCart RoundAbout Slider is a dynamic and visually engaging extension designed to enhance the look and functionality of your online store. It features a smooth, roundabout carousel that adds a modern touch to your website, making it ideal for showcasing featured products, special offers, and key messages.One of its standout capabilities is the flexible layout setting, which allows you to display the slider on almost every page of your site, ensuring that your promotional content reaches visitors no matter where they navigate.Configure The Round About SliderThe admin can create multiple sliders to fulfil their requirement.Each slider has its height and width.You can add as many images as you like in the slider. Also, you can set each image's position using the slider's sort option.Write the Heading and description for a particular slide. You can enter the link of the page where you want to take the user when they click on the button.These sliders will be available to select layout settings on the page. You can enable or disable the slider whenever the requirement changes. A list of all sliders will be displayed on the slider page in the setting.Mobile ResponsivenessThe slider's responsive design ensures that the design looks great on all devices,Whileits customizable options let the admin fine-tune the navigation buttons, transitions, and overall style to perfectly match your brand identity.The slider images will automatically adjust according to the device screen width. It will look perfect on mobile, tablet, laptop, computer etc.Display Slider on Any Page of the WebsiteThe admin can navigate to the Design > Layout settings menu and edit the page where the slider should appear. The admin canselect the roundabout slider from the list of modules at the top, left, right, and bottom of the page. Finally, the admin can decide the slider's position,as it will appear after the menu, products list, category list, etc.When you go to the home page front store, you will see that the slider is displayed in the same position as per the layout setting.Working With Most ThemesThis slider extension is tested with most OpenCart themes to make sure you will get the slider on your website just after applying the setting, you will have the working slider.Journal, Porto, Shoppica, Fastor, and Sellya  are names of a few themes where we tested this slider.This responsive slider uses the website theme's button style such as text color, font family, font size, etc. to display on slider navigation buttons. It will provide a consistent and cohesive look that enhances your website's overall design.Compatible With Various Versions of OpenCartThis slider module is compatible with the latest version of OpenCart. You can use it on your website without worrying about compatibility,as it works perfectly with versions 2x, 3x, and 4x.This extensive compatibility ensures that you can upgrade your store confidently while maintaining a smooth and reliable user experience across all versions.Installation Is EasyThis OpenCart slider module uses the OCMOD for installation. While and after the installation your website files remain untouched.The slider will be added to the page using XML technology.Comprehensive online documentation and a step-by-step video guide are available to walk you through the installation and setup process.These resources make it simple for beginners to get the slider up and running quickly ensuring a hassle-free experience.SupportIf you want to make improvements to your website, develop a module, have a sale question, or just looking for help related to this slider extension please create the ticket. One of our team members will reply as soon as possible.","2.1.0.2, 2.1.0.1, 2.0.3.1, 2.0.2.0, 2.0.1.1, 2.0.1.0 1.5.6.4, 1.5.6.3, 1.5.6.2, 1.5.6.1, 1.5.6 2.3.0.2, 2.3.0.1, 2.3.0.0, 2.2.0.0 3.0.2.0, 3.0.3.0, 3.0.3.1, 3.0.3.2, 3.0.3.6, 3.0.3.7, 3.0.3.8, 3.0.3.9, 3.0.4.0 4.0.2.3, 4.0.2.2, 4.0.2.1, 4.0.2.0, 4.0.1.1, 4.0.1.0, 4.1.0.0, 4.1.0.1, 4.1.0.2, 4.1.0.3",https://www.demoopencart.in/roundabout/oc3/index.php?route=common/home,https://www.demoopencart.in/roundabout/oc3/admin/index.php?route=extension/module/slideshow,https://www.opencartextensions.in/opencart-modules/roundabout
SEO Custom title (Multilanguage supported) 1.5.x,$28.49,$29.99,"TMD is an Offical Partner of OpenCartView Profile:TMD OpenCart Extensions IndiaOverview of TMD Custom SEO TitleOptimize your Opencart store and product for search engines with our Opencart SEO Custom Title module.It allows you to write custom titles for all your products, categories, information pages, and stores.The custom Title enables you to choose the conscious name and title with a higher chance of ranking on search results. This module also provides Multi-lingual support and is Compatible with Opencart 1.5xWrite Custom Title for ProductsCustom SEO Title Extension lets you write custom titles for each product.You can write clear and relevant titles that accurately describe the product and are understandable by search engines.If customers find the title interesting they will visit your website.Edit Categories TitleYou can write the titles of your OpenCart categories.You will find a new field called Title, just below the category name.Admin can improve the SEO of category pages and make them more descriptive and attractive to potential customers who are browsing through search engine results with this module.Use the Power of Personalized TitlesIt enhances the customer browsing experience with tailor-madetitles that guide them directly to what product, category, manufacturer or store they're searching for.Our Opencart SEO Custom Title module ensures that every search and click is guided by titles optimized specifically for customer needs.Find What You Need, FasterExplore our store with ease! Each brand has its special title made just for you.No more lengthy descriptions—now your customers will find exactly what they like.Enhance Customer Shopping JourneyWith custom SEO titles, every click brings your customers closer to their perfect purchase. Whether it's a specific product, category, manufacturer, or our store in general, our customized titles make your customer search easy, saving them time and hassle.Multi-lingual SupportSEO custom Title supports multiple languages which allows you to Write custom titles in regional languages as well.It Increases the chances of search engine ranking in different geographical locations with their regional languages.Improved SEOThe sole purpose of developing and designing this Opencart Custom SEO title module is to enable Opencart store owners to write custom titles for their store, products, and different pages and increase the ranking of SEO.So, by using this module strategically, Opencart store owner can boost their SEO ranking and reach out to real potential customers quickly.","1.5.0, 1.5.0.1, 1.5.0.2, 1.5.0.3, 1.5.0.4, 1.5.0.5, 1.5.1, 1.5.1.1, 1.5.1.2, 1.5.1.3, 1.5.2, 1.5.2.1, 1.5.3, 1.5.3.1, 1.5.4, 1.5.4.1, 1.5.5, 1.5.5.1, 1.5.6, 1.5.6.1, 1.5.6.2, 1.5.6.3, 1.5.6.4",https://www.demoopencart.in/seoimagealttitle/oc3/index.php?route=common/home,https://www.demoopencart.in/seoimagealttitle/oc3/admin/index.php?route=extension/module/tmdseotitle,https://www.opencartextensions.in/opencart-modules/seo-custom-title-multilanguage-supported
"SEO Image Alt And Title Manager  (2.x & 3.x , 4.x)",$28.49,$29.99,"TMD is an Official Partner of OpenCartView Profile:TMD OpenCart Extensions IndiaOverview Of TMD OpenCart Product Image Title And Alt ModuleThe SEO Image Title & Alt module allows you to configure  Product Image Title and Product Image Alt for all of your products in the store.These are controlled by the admin panel so according to your need, you can change the product image title and alt for your SEO purpose at any time you want.The module will not affect any core file of OpenCart so it won't encounter you with any kind of issues during your store updates.Benefits Of Using A Product OpenCart ALT And Image Title.OpenCart Product Image Title and the Alt attribute are beneficial for all store owners in a number of ways.So by using this module you increase the chance of your traffic and visibility for your store.For any e-commerce store images represent the heart of your products and display units to gain traction from your audience.However, if you are not optimizing your images with the right image title and alt attribute, it has a rare chance of visibility on searches.No Core File Changes During Installation1. Copy all files in your root folder2. Does not overwrite any master filesFeatures* Applying ALT and the title of images will have a major impact on your store's SEO results.* Module allows setting image alt and title for product, category, option, and banners image.* Module automates ALT tag creation for a product, category, option, and banner images that produce quality content and improve your site’s page ranking.* Module Increase your sales* you can Set apart from the competition with different SEO image rules for each image* with highly effective SEO, customers can find your store easily, this thing helps keep customers loyal* Overall improves the SEO score of a website in Google*  Fast loading and sleek.*  Free and fast support.*  Support all versions.*  It supports multi-language.*  Support multi-store.*  Installation guidance Included in the documentation link*  We provide free support & the best support.If you find any problem with this module you can contactIf you have any kind of questions, suggestions, or looking for support. Please create a ticket.Copyright:* Download one time for only one domain (store) you can not use multi-domain (or store)for multiple domain packages please contact support* any other changes in this module without notifying us are not validSupportAny question suggestion is most welcome. If you have any kind of question, suggestion, or looking for support. Please create a ticket.","2.1.0.2, 2.1.0.1, 2.0.3.1, 2.0.2.0, 2.0.1.1, 2.0.1.0, 2.0.0.0 2.3.0.2, 2.3.0.1, 2.3.0.0, 2.2.0.0 2.3.0.2, 2.3.0.1, 2.3.0.0 2.1.0.2, 2.1.0.1 2.0.1.1 3.0.3.9, 3.0.3.8, 3.0.3.7, 3.0.3.6, 3.0.3.2, 3.0.3.1, 3.0.3.0, 3.0.2.0, 3.0.1.3 (Beta), 3.0.1.2, 3.0.1.1, 3.0.0.0, 3.0.4.0, 3.1.0.0alpha 4.0.2.3, 4.0.2.2, 4.0.2.1, 4.0.2.0, 4.0.1.1, 4.0.1.0, 4.1.0.0, 4.1.0.1, 4.1.0.2, 4.1.0.3",https://www.demoopencart.in/seoimagealttitle/oc3/index.php?route=common/home,https://www.demoopencart.in/seoimagealttitle/oc3/admin/index.php?route=extension/module/tmdseotitle&user_token=l9fpuV3zkiTp9DfG5qupV5VrDYuK4OxS,https://www.opencartextensions.in/opencart-modules/seo-image-alt-and-title-manager
Seo Mega Pack,$28.49,$29.99,"TMD is an Offical Partner of OpenCartView Profile:TMD OpenCart Extensions IndiaOverview of TMD OpenCart SEOThis module lets ecommerce store owners optimize their website's On-Page to enhance their visibility in search engine rankings. It comes with SEO meta tags such as title and semantic headlines to SEO URLs and 404 Redirect Management and covers all the essential SEO properties for the website.To reduce the store SEO management work, this module offers the automatic generation of titles, meta keywords, meta descriptions, image ALT, title tags, SEO URL, etc. Using this SEO module ensures that your website remains compatible with on-page SEO techniques.It is a simple but effective solution that has been proven to deliver the result and drive traffic to your website. It works with multiple versions of OpenCart and is compatible with multi-language.Setting SEO of WebsiteThis is a one-in-all SEO solution for your website packed with all the essential tools and settings. The website can adjust these settings according to SEO strategies.It lets the admin do the setting such as limiting the chars in SEO title, description, keywords, url, H2 heading and colour, image alt and title text char limit. It has a setting for the 404-page tracking to enable or disable, the cron job to automatically generate the SEO metadata for products, categories, information, image, etc.There is a list of Shortcodes given in the setting to tell the module how it should autogenerate the content. You can check the list below to see all the features and settings of this SEO extension.1. Gerenate title, description, keywords, and heading2. 404 Page not found handling3. SEOL URL character limit4. Description char limit  above pages5. H2 heading text char limit and color6. Cron job, rich snippt7. Sitemap8. Generate image alt, title text9. Redirect page setting10. Custom SEO URL11. Edit the SEO metadata  and heading12. not found page url list13. Shortcode setting14. FilterAutomatic Generation of SEO Important ElementsThis OpenCart SEO module will automatically generate the SEO-optimized title, meta tags such as description, keywords not only the product but also categories, and manufacturer and information pages. You can then further make the improvement if needed. This feature streamlines your SEO efforts, enhancing visibility without manual intervention.You can generate the SEO metadata in multi-language. Every active langauge will have a seperate SEO metadata section and the admin can hit the generate button to get the title, description, keywords, etc in that language.It will take care of most of the SEO work in your ecommerce website and will help your website to rank in the search engine and people will find you.Creation of SEO-Friendly URLsBy utilizing the OpenCart module's fullest capabilities, you can generate an SEO-friendly URL for your products, categories, manufacturers, information, custom page, etc . This url will be humanly readable, following the Google url standard and keeping the url shorter to make sure it improves website ranking.Admin can generate or write the URL in all the active languages in the website so that user experience remains consistent.Admin can also write the SEO url for the  information page such as contact, about, privacy, etc. Also, This module gives the option to write the SEO url for the custom page. Admin can make sure every page of the website must have the SEO url.404 url ManagementOpenCart SEO extension comes with an in-built page not found urls auto detection tool which provides comprehensive control handling the page not found error on the website. This extension records all the 404 pages that occurred on the website along with a number of hits.Admin can write the pattern to exclude tracking of certain 404 pages. There is a setting to auto-redirect users and bots to search the page when they hit the page not found error. It improves user experience and site navigation.Manage Redirect URLsYou can redirect the page url that points to not found, the error page or another page to the permanent redirect (301) in the module setting. The redirect work is handled by the module as soon as the user or bot lands on the old page.Just add the page url that  you want to move in the old section and the page that will the user see when redirect to the new page field, and hit the save button. It is easy to manage the redirect url list. You can delete one or multiple redirect URLs from the list. The SEO plugin consists of a search filter that lets the admin filter out the result in the redirect URLs.Seamless Automated Sitemap GenerationSitemap is an essential part of every website. This SEO tool will take care of the sitemap thing for your website. All the new page and old page will be added into the sitemap which can be submitted to search engines. The sitemap will enhance visitability by quickly discovering new content through the search engine.Also, the search engine crawler bot time is automatically set by this OpenCart SEO module to one week. It indicates that search engine bots can revisit your website in the next week to look for changes you have made. Thus getting rid of server load and search engine crawler's issues.Image Alt and Title Generate And EditIt is important to have the right alt and title tag on the image so that search engines get information about the image. This module list all the product name and image and it's named in the tabular form. You will see the auto-generated  alt tag text and title in muli-language.Admin can edit the name of the image, alt tag and title in the muli-language of the image in the list. Also, there is a search present at the top to find the particular image.Rich SnippetA rich snippet is a good way to attract traffic from the search engine. This SEO plugin offers a list of product attributes that could be shown in the search engine product result. In the rich snippet setting select the product attributes. These attributes will appear just after the meta description such as price, stock, shipping, discount, etc.You also get the Facebook graph API integration so that your product gets better visibility on Facebook Share. You can also enable the Twitter card setting to automatically show the product image when someone shares the product on Twitter.Cron jobIt helps the store owner to keep the website updated  to align with the on-page SEO. This can be done using the cron job. You  will find the setting for the cron job that lets you select how the cron job program  should work and what SEO data it will automatically generate.you can select the meta tags, h2 heading, the title of the product, category, manufacturer, information page, etc. And the module will set the cron job program according to these settings. You'll find the cron job file url to set the cron job on the serverMulti-Language and Multi-Store SupportIt will allow your website to match your website SEO plan with the marketing plan to broaden your reach to a global audience. This OpenCart SEO extension is fully compatible with multi-language. Whether you are running a single-store or multi-store. You will find this extension working for all kinds of websites.Compatibility With Most OpenCart ThemesFrom the default theme, journal theme to custom themes, enjoy wide compatibility, catering to various aesthetics. The  OpenCart SEO pro extension will add the SEO-related codes to the page at the time of loading.Sellya, Shoppica, Faster, Journal, Sellegance, e-Market, Bigshop, and SimpleGreat are some names of OpenCart themes that we have done testing. This extension supports the Journal 2x and 3x versions.Compatibility with Various VersionsTMD developed this SEO extension by following the official guidelines that make it compatible with most of the OpenCart versions. This extension is designed for OpenCart 2x and 3x versions. Making it easier to migrate from the lower version to the higher version of OpenCart. You will find this extension to work all the time.Effortless Installation and ManagementThe installation and management of OpenCart seo pack Pro is smooth and hassle-free. Your website files remain untouched. This extension uses the Ocmod/Vqmod. You can install this extension on your OpenCart website by following one of 2 methods.Either use the extension installer, present in the website admin to upload the module zip file. Second method.  unzip the downloaded module file and connect your website using cPanel or use the SFTP connection to upload the module files on the server manually.  After that login to the admin panel to activate the SEO module from the module list page.SupportIf you want to do any kind of customization and new development on your website. Or looking to get help for the OpenCart module or theme. Please create a ticket. One of our team members will contact you.","2.3.0.2, 2.3.0.1, 2.3.0.0 3.0.3.8, 3.0.3.7, 3.0.3.6, 3.0.3.2, 3.0.3.1, 3.0.3.0, 3.0.2.0, 3.0.1.2, 3.0.1.1, 3.0.0.0 2.1.0.2, 2.1.0.1 4.0.0.0 4.0.2.2, 4.0.2.1, 4.0.2.0, 4.0.1.1, 4.0.1.0, 4.0.2.3",https://www.demoopencart.in/seomegapack/oc3/,https://www.demoopencart.in/seomegapack/oc3/admin/index.php?route=extension/module/tmdmegapack&user_token=gDdi3aVL7Hxnqdi3mqGZZet6xyDv0Faj,https://www.opencartextensions.in/opencart-modules/seo-mega-pack
N/A,$46.55,$49.00,N/A,N/A,,,https://www.opencartextensions.in/opencart-modules/seo-title 
"OpenCart SEO URL EXTRA PAGES 2.x,3.x,4.x",$28.49,$29.99,"TMD is an Official Partner of OpenCartView Profile:TMD OpenCart Extensions IndiaOverview Of TMD Opencart Seo Url Information PagesThe advance SEO url module is to modify titles, SEO URLs, meta-description, and meta-keyword of any web page of opencart by admin.		This extension allows adding a keyword for SEO URLs, titles for pages, meta-description, and meta-keyword for information pages. Our all modules will not affect any core file of OpenCart so it will not issue during updating.Install As Instructions:Just upload the vqmod folder.1. Copy all files in your root folder with no core file changes present.2. Does not overwrite any master files.3. There is no need to install vqmod. We provide an ocmod file in a zip code. You have to upload an ocmod file from admin Extensions->Extension Installer.Feature1. Easy Installation.2. Easy to control from admin.3. Does not overwrite any master files.4. Free Support.Supports OpenCart 2.x and 3.x VersionsTMDmade this module work on OpenCart versions 2.x and 3.x versions. A module can be easily installed via the upload module section in admin, on your website. Becausethis module uses OCMOD. Which does not overwrite core files. It also works with could-based online websites.Our all modules, extension, and themes are plug-and-play. Just install and you are ready to use them right away.SupportAll questions or suggestions are most welcome. If you have any kind of questions, or suggestions, or looking for support. Please create a ticket.","2.1.0.2, 2.1.0.1, 2.0.3.1, 2.0.2.0, 2.0.1.1, 2.0.1.0, 2.0.0.0 2.2.0.0 2.3.0.2, 2.3.0.1, 2.3.0.0 3.0.2.0, 3.0.2.1 (Beta), 3.0.3.0, 3.0.3.1, 3.0.3.2, 3.0.3.6, 3.0.3.7, 3.0.3.9, 3.0.4.0 4.0.0.0, 4.0.1.0, 4.0.1.1, 4.0.2.0, 4.0.2.1, 4.0.2.2, 4.0.2.3",https://www.demoopencart.in/seourlextrapages/oc3/accountregister123,https://www.demoopencart.in/seourlextrapages/oc3/admin/index.php?route=catalog/linkroute,https://www.opencartextensions.in/opencart-modules/seo-url-extra-pages-2.0
