Title,Price,Original Price,Description,OpenCart Versions,Demo Link,Admin Demo Link,Source URL
Sold Every Where,$28.49,$29.99,"TMD is an Offical Partner of OpenCartView Profile:TMD OpenCart Extensions IndiaOverview of TMD OpenCart Product Sold Quantity Everywhere ModuleThis extension can help to boost the product's credibility by displaying the total number of units sold for each product. It gives the flexibility to display the sold-out quantity in different ways.You can display real-time sales figures or manually adjust the sale number of individual products. Moreover, the sold quantity will automatically update as soon as the product is purchased by the customer.By showing the sale counting, you not only showcase popularity but also boost sales conversion by building trust among your customers. This extension is compatible with the default OpenCart modules. Admin can adjust the colors of sold quantity to match with your website. It works with the latest version of OpenCart.Easy Product Wise SettingThe dashboard offers a clear product list showcasing product names, models, and actual sales numbers. It will display all the products present on the website.Admin can easily update the sales figures of the individual products – the revised count seamlessly integrates with the existing number, providing an aggregate sales total on the products list. Admin can show real sale count, add the number into real sale figure or minus from the real sale figure.The sold quantity will automatically adjust according to the setting.Admin can locate products swiftly with our advanced filtering feature, especially beneficial for sites with an extensive product range. Just input the product name or model, and our ""String contains the function"" will match with products and list out the matching products in the result.✔Show real sale figure✔Add the number to the real sale figure✔Display less sale quantity✔User-friendly interfaceAutomatically Display Sold Quantity on ProductsThe sold quantity is displayed on products seamlessly across the website.Whether on the homepage, search results, category pages, or in grid and list views, product sold quantities are automatically updated and showcased.This enhancement is embedded within the default modules, ensuring visitors are always informed about how many units of a specific product have been sold.This suggests that showing the number of units sold can enhance trust and belief in the product's popularity and quality. It is optimized for the best performance of the website and loading time.Write Sold Quantity Text  and Update ColorTailor the module to your site's aesthetic. Modify the display text, and adjust text and background colors to align with your brand's and website color theme.It comes with the text and background color setting. The javascript color library gives thousands of web color selections. Admin can select the text and background color according to the website theme color theme.The color setting applies instantly on the product sold quantity text and background. Also, the Admin can write custom text which will display on the product before the sale count.Default OpenCart Modules Also SupportThis sold quantity extension is developed by following the OpenCart official guidelines.Our module boasts universal compatibility with all default OpenCart modules, encompassing featured items, the latest products, bestsellers, specials, and beyond.Wherever these extensions are placed on the website, the sold-out quantity will automatically inserted in the products automatically. It is done smoothly without touching the existing content or design of the website.Works great With Most of the OpenCart ThemesIt is designed in such a way that its features are accessible for all OpenCart themes. The extension works perfectly with all themes available in the market. We have done testing with highly-sold OpenCart themes as well as well-known themes. The design is very adaptable & responsive, perfectly aligned with all kinds of devices like mobile, tablet, laptop, or desktop. All our modules are plug-and-play.OpenCart sold everywhere extension is tested with many famous themes. Journal, Shoppica, Fastor, Sellyaare some names of themes. Custom themes require some additional work.Compatible with Multiple versions of OpenCartIt stands tested across OpenCart versions 2x and 3x, ensuring robust functionality up to the latest 4x version. Rigorous unit testing guarantees flawless website performance. You will always find this extension compatible with your website.InstallationWith the utilization of OCMOD, there's zero interference with core files. All modifications are applied in real time using XML, ensuring the integrity of your original files.Like other extensions, this module can be installed using two methods, First use the OpenCart admin's extension installer easily and simply. Or upload the module's file on your website manually via FileZilla, CutFTP other software.SupportIf you are looking for the development or customization in your OpenCart website or theme or want to help install this extension. Just create a ticket. Our support team will help you get it done.","2.3.0.2, 2.3.0.1, 2.3.0.0 2.2.0.0, 2.1.0.2, 2.1.0.1, 2.0.3.1, 2.0.2.0, 2.0.1.1, 2.0.1.0 3.0.3.8, 3.0.3.7, 3.0.3.6, 3.0.3.2, 3.0.3.1, 3.0.3.0, 3.0.2.0, 3.0.1.2, 3.0.1.1, 3.0.0.0, 3.0.3.9, 3.0.4.0 4.0.2.3, 4.0.2.2, 4.0.2.1, 4.0.2.0, 4.0.1.1, 4.0.1.0, 4.1.0.0, 4.1.0.1, 4.1.0.2, 4.1.0.3",https://www.demoopencart.in/soldverywhere/soldverywhere.html,https://www.demoopencart.in/soldverywhere/oc3/admin/index.php?route=extension/module/soldeverywhere&user_token=XNlAYdMgA2FMvINdrnV44jLYMLcHMNbd,https://www.opencartextensions.in/opencart-modules/sold-every-where
Store Locator With Google Maps,$28.49,$29.99,"TMD is an Offical Partner of OpenCartView Profile:TMD OpenCart Extensions IndiaWhats is TMD OpenCart Store locatorA business owner can save their physical store detail on the OpenCart website. Customers can place an order and take the order from the store. Admin can set the shipping cost for store pickup shipping method. The customer has to select the nearby physical store on the checkout page. Store name, pickup date and time information saved in the order.This module has a professionally designed page displaying physical store information, a search bar and Google Maps.This extension can find the nearby store from the user's location by knowing their GPS location. Or they can search manually by entering the address and defining the range distance from their address such as 5km, 10km, 20km, etc.It will reduce the cost of shipping and order delivery become faster and smoother.This extension has color setting that lets the admin update the colors of the store locator page according to the website theme. Store locator extension works with multi-language and easily installs on 2x, 3x, and 4x versions of OpenCart.Configure the Store Locator With Google MapAdmin can set the number of days when an order is available for pickup after the order is placed by the customer. This will help the store owner to prepare the order.Enter the Google Map API key in the setting to activate Map.You can also set the Google Maps zoom level, default it set to 0, and can set the starting zoom level to any number between 0-10. Also, set the search distance range in Kilometers.This extension also creates a new shipping method called ""Store Locator"". Admin can set the shipping cost for this shipping method.There is color and a multi-language text setting available. All these setting is automatically applied to all the physical stores.✔Store open and close days✔set pickup date after the order placed✔Time slot for order pickup✔Google Maps setting✔Multi-language✔Color settingSave The Physical Store InformationNavigate to Store Locator Menu > Select the Store List page > Click on the ""Add New"" button > Enter the details such as name, email, telephone/mobile number, address, etc in the store.This extension supports two addresses of one store. Admin can move the pin on Google Maps to set the store's exact location.The admin can set the opening and closing times of the physical store, and select the working days. Unselected days will count as holidays. During this period, customers can come and take their orders.Admin can hide or delete the physical store when it is no longer functioning.All enabled stores are instantly available on the store search and the checkout page in the order delivery shipping method.✔Store open and close days✔Timing✔Name✔E-mail✔Telephone✔Fax✔Address, address2✔Set Location on Google Map✔Pincode✔City, state✔Country✔Image✔Days✔Enable or disable the storeStore Locator Search PageThe admin can show or hide the header of the store search page. It will remove the entire header including the menu on desktop and mobile view.It supports two kinds of search methods. Either user can share the live location with the website to find the nearest stores. Or they can manually enter the address to find the nearest stores.Moreover, they can set the maximum distance range in kilometres, and the system will try to find the store within the given distance range. This module uses the Google Map search API to give the nearest store location.Select the Physical Store For Order Pickup On the Checkout PageOn the checkout page,customers will see a ""Store Pickup"" shipping method. On selecting the store pickup method, they will promote Select the store.The module will fetch the selected store's opening date and pickup time slot. All the store lists are available on the shipping method.Store information In Order detail And InvoiceThe details of store pickup will be stored with the order. A new section ""Store Pickup"" just above the payment information on the order detail page will be automatically created.Admin and customer both can view the pickup information on the order detail page. Also, pick-up information will be printed on the order invoice.The website can pass the order details to the store manager to prepare the items for delivery.Store Pickup Sale Report With FilterYou can track the performance of the stores and their order pickup request. This report is generated by the store locator module and contains only those orders which had store pickup as a shipping method.The report contains necessary fields such as order ID, store name, pickup date, time, order date, and view order button. Admin can view the order detail by clicking the view button.You can create the report by store name, and order id, or use the date filter to have monthly/yearly or custom date range reports.Match With Your Website Color ThemeThis extension comes with the color setting for the store locator pages. Admin can update the colors of elements to make the store locator pages to be part of the website.Admin can update the background and text color of the search box, reset and submit buttons, store information, hover color of buttons, etc.This OpenCart Store locator extension uses the website's default color theme to show the store list on checkout to maintain consistency.Background Color✔Search Box✔Pickup Schedule✔Store Button✔Store Button Hover✔Save Button✔Reset Button✔Search ButtonText Color✔Store Button✔Store Button Hover✔Save Button✔Reset Button✔Search ButtonWorks With Multi-languageThis extension lets the admin enter the text in multiple languages.This extension will automatically detect the active languages on the website and display them with the country's flag in the language setting. Every language has its tab, the admin can write the text in that language.Whenever the user/customer changes the language of the website, Store information that comes from this module will also be updated to that language.Supports Almost All OpenCart ThemesWe always test our modules on various themes to make sure they work perfectly on them. Some of the themes areSellya, Shoppica, Faster, Journal, Sellegance, e-Market, Bigshop, and SimpleGreat.The module uses the website's current theme's bootstrap and other CSS for styling the elements on the store search page, displaying the store list on checkout, order details, invoice, etc.Compatible With 2x and 3x versions of OpenCartTMD develops all the modules and themes by following the official documentation of OpenCart. It uses OCMOD for installation. Website core files remain intact. All the functionality is added at the runtime on the website using XML files. Which makes it compatible with OpenCart versions 2x and 3x.SupportFree installation is given. If you have a pre-sale question or looking for help with your website. Please create a support ticket. Our specialist will reach you as soon as possible.","3.0.3.8, 3.0.3.7, 3.0.3.6, 3.0.3.2, 3.0.3.1, 3.0.3.0, 3.0.2.0, 3.0.1.2, 3.0.1.1, 3.0.0.0, 3.0.3.9, 3.0.4.0 2.1.0.2, 2.1.0.1, 2.0.3.1, 2.0.2.0, 2.0.1.1, 2.0.1.0 2.3.0.2, 2.3.0.1, 2.3.0.0 4.0.2.3, 4.0.2.2, 4.0.2.1, 4.0.2.0, 4.0.1.1, 4.0.1.0, 4.1.0.0, 4.1.0.1, 4.1.0.2, 4.1.0.3",https://www.demoopencart.in/storelocatorgooglemaps/oc3/index.php?route=extension/tmd/tmdstore,https://www.demoopencart.in/storelocatorgooglemaps/oc3/admin/index.php?route=extension/module/tmdstorelocatore,https://www.opencartextensions.in/opencart-modules/store-locator
Stripe Payment Gateway,$28.49,$29.99,"TMD is an Offical Partner of OpenCartView Profile:TMD OpenCart Extensions IndiaOverview of TMD OpenCart Stripe Payment GatewayEnhance your OpenCart store's payment capabilities with the Stripe payment method module. This powerful module integrates Stripe, a trusted global payment gateway, into your e-commerce platform. it allows customers to pay easily and securely. This payment gateway accepts multiple payment types, including credit and debit cards.The module is designed for easy configuration and optimized for reliability and fast processing to provide a smooth checkout experience for your customersSecure Payments for Peace of MindStrip payment providesPCI-compliant and 3d security, so every transaction is protected.Also, with advanced encryption and fraud prevention tools, your store's order details as well as customers' data are safeguarded effectively.Supports Multiple Payment MethodsThe Strip payment gatewayaccepts major credit and debit cards, including Visa, MasterCard, American Express,etc. Also, in most countries, itsupports local debit cardsby compiling those countries' laws.Let your customers pay easily using local payment methods. It will increase the trust in the customer's eyes.You can easily set up subscription payments and recurring billing for your website orders. Your customer will have the option to cancel the subscription.Real-Time Currency ConversionYou can easily target the international customer by offering them to pay in their local currency.The Strip will automatically adjust the payable amount from one currency to another by the current currency exchange rate.It helps you to provide a frictionless shopping experience for global customers by eliminating currency-related confusion.Effortless Transaction ManagementThe OpenCart store owner caneasily track the transaction details for each order directly from the store admin dashboard. Manage refunds, chargebacks, and disputes from the official strip website.This module is integrated so well with the strip payment gateway, that you will get real-time payment email notifications in the OpenCart store.How to Set Up the Stripe Payment Gateway in OpenCartThere aretwo ways to install the moduleon the OpenCart website.You can download the Stripe payment gateway module from the OpenCart marketplace or our website.The next step is to install the extension by navigating the module installation page in the admin. Upload the extension zip file. wait for the success message.Another way is to extract the module zip file and upload the files on the server using SFTP client software or the CPANEL, HPANEL.Log in to the admin panel of your website and navigate to Extensions → select Payments.Configure Stripe API Keys by entering your Publishable Key and Secret Key from the Stripe dashboard.Customize Settings to fit your store’s requirements (e.g., currency options, payment methods).Quick & Easy SetupAll our modules and extensions are plug-and-play. There is no need for coding skills required. Our module has comprehensive online documentation, providing step-by-step instructions to help you configure the payment gateway effortlessly.You can offer your customers a seamless and secure checkout experience with minimal setup time. Whether you’re a store owner or a developer, this module simplifies payment integration.Multi-Langauge CompatibleIntegrates directly into OpenCart’s checkout process, providing a consistent user experience for your customers.This module is compatible with multiple languages. All the installed languages will be detected and displayed in the settings.Payment details will be shown in the customer's preferred language.Works With Multi-StoreThe OpenCart Stripe Payment extension is fully compatible with OpenCart multi-store setups.This extension will automatically detect all available multi-stores and automatically integrate and make them available for payment.It ensures a seamless payment experience.SupportIf you want to develop modules, an extension of the theme for your website, update in your OpenCart website,  or are looking for help or have pre-sale queries related to this Strip payment gateway module. Please create a ticket.  One of our team members will contact you as soon as possible.","4.0.2.3, 4.0.2.2, 4.0.2.1, 4.0.2.0, 4.0.1.1, 4.0.1.0, 4.1.0.0, 4.1.0.1, 4.1.0.2, 4.1.0.3 3.0.3.7, 3.0.3.8, 3.0.3.9, 3.0.4.0 3.0.2.0, 3.0.2.1 (Beta), 3.0.3.0, 3.0.3.1, 3.0.3.2 2.3.0.0, 2.3.0.1, 2.3.0.2",https://www.demoopencart.in/stripepayment/oc3/,https://www.demoopencart.in/stripepayment/oc3/admin/index.php?route=extension/payment/tmd_stripe_payment&user_token=xCDwo1Rf7NIwuVJT86Hhbhm1tDbYNMGL,https://www.opencartextensions.in/opencart-modules/stripe-payment-gateway
Sub Information Pages,$28.49,$29.99,"TMD is an Offical Partner of OpenCartView Profile:TMD OpenCart Extensions IndiaOverview of TMD OpenCart Sub Information PageThis extension will let you show the information page links in parent-child relations. It will help a website to display the related important pages to each other in a sequential manner in the information section. In the page layout setting, you can select the moduleThis innovative module allows you to easily create a structured and new information page link section. Select a parent link for the page and display sub-information pages under it. You can remove the parent option to make the sub page any time.It supports the multi-store. This module fits perfectly with various themes and is compatible with the latest version of OpenCart.Select the Parent Information PageThis OpenCart extension automaticallyadds the parent selection option in the information page's Data tab. While editing the existing page or creating a new page, It lets the admin select the parent page.All the previously created information pages will automatically appear in the parent option.Only the enabled status page will be displayed. After selecting the parent page, the current page will become a child and will be displayed accordingly.It will be very helpful to show the related pages to customers. For example, an ecommerce website can show the ""Shipment Policy"" as the parent page and add all the shipment, and courier company policies as sub-pages. It will help customers know how their orders will be processed and shipped.Show the page on the information list sectionIn the layout section of OpenCart, This extension willadd a new module called ""Parent sub information page"". You can select it to display on any page of the website from the layout section.Either display on the top, left, right, or bottom of the page. It will automatically display the selected position of the page. In the information page box, all the information page links will be visible, one which has the parent option selected will be displayed under that parent page. It will look like a parent-child relationship.Working With Most ThemesThis extension tested with most of the OpenCart themes.It will blend with your website theme's colour, style and branding. Because it will use the website CSS to display the sub-information page link.After extensive testing across multiple themes, this module is proven to integrate smoothly, offering you peace of mind that it will adapt to your specific theme effortlessly.Compatible With Multiple OpenCart VersionsOur module iscompatible with the latest OpenCart 4x version—it also works flawlessly with 2x and 3x versions. This ensures your website stays up-to-date and functional, regardless of the OpenCart version you're on.It uses the OCMOD for the installation. That means your website files will remain untouched while and after the module installation. All the functionality will be added to the website at the time of loading, using XML.SupportAll our customers are happy with us because we provide the best free support. For any questions & suggestion feels free to contact us at. Do you pre-sale questions or have support questions? Please create a ticket. We will help you to get it working.","2.1.0.2, 2.1.0.1, 2.0.3.1, 2.0.2.0, 2.0.1.1, 2.0.1.0 2.2.0.0 3.0.3.8, 3.0.3.7, 3.0.3.6, 3.0.3.2, 3.0.3.1, 3.0.3.0, 3.0.2.0, 3.0.1.2, 3.0.1.1, 3.0.0.0, 3.0.3.9, 3.0.4.0 2.3.0.2, 2.3.0.1, 2.3.0.0 4.0.2.3, 4.0.2.2, 4.0.2.1, 4.0.2.0, 4.0.1.1, 4.0.1.0",https://www.demoopencart.in/subinformationpages/oc3/index.php?route=common/home,https://www.demoopencart.in/subinformationpages/oc3/admin/index.php?route=extension/module/information_parent&user_token=EsmT7uwu9aAeJ2CFdAnTAyIeVjqFlu6w,https://www.opencartextensions.in/opencart-modules/sub-information-pages
Subcategory Image Module 1.5.x,$28.49,$29.99,"TMD is an Offical Partner of OpenCartView Profile:TMD OpenCart Extensions IndiaOverview of OpenCart Subcategory Image ModuleThe  extension is designed to enhance the visual appeal and user experience of your store. It allows you to show the image of subcategories with plenty of customization options to make images the same as your store branding.This OpenCart extension also offers different features that enable admins to design and display the subcategories images as per their requirements on the store.Customization for Sub Category imagesIt gives you control over when you want to show the subcategory images and when you don't. Admin can easily enable or disable the extension from the admin panel. You can also choose to display or hide images, Title, and description text as well.Choose the Image Height and WidthThe subcategory image extension for OpenCart comes with the option to choose and edit the height and width of the subcategory images shown on the store effortlessly. Admin can change the Image height and width from the general setting of the Admin panel.This feature ensures consistent design and aesthetics in the store.Control Description Text LengthEach sub-category image has its description. Admin can increase or decrease the length of these descriptions as per their preference.This will prevent your image section from becoming bulky and boring and you will be able to give your customers the experience of a high-quality professional store.Select Your Preferred ImageOne can choose images for each subcategory according to their needs. You can either use default images or you can refine images to best suit the subcategories.It will make sure, You're using high-quality images for better visual experiences.Different LayoutsThe Opencart Sub category image module has two different layouts for subcategory images. You can choose any of them that best suits your store design and customer experience goals. The admin can change between these two layouts anytime from settings.Customize the ColorEnsure the color of The subcategories images matches the store brand color. The color customization option is designed to make the sub-category image section an inherent part of the store.Multi-language and Multi Theme supportIt supports multiple languages and works completely well with all the Opencart themes. You can use the extension with any language and theme without worrying about quality and aesthetics issues.Features1. Easy Installation2. Do not overwrite any master files.3. Free Support4. You can show an image of a subcategory in the list view of the category.5. You can show an image of the subcategory in front as well.6. You can set the height and width of the subcategory image in admin. For this Go to System->settings then click on the edit link then click on the image tab there will be a subcategory image column where you can set the height and width of the subcategory image.7. So this module provides you with fast and seeks service.SupportIf you have any kind of questions, or suggestions, or looking for support. Please create a ticket. We will get back to you as soon as possible.","1.5.6.4, 1.5.6.3, 1.5.6.2, 1.5.6.1, 1.5.6, 1.5.5.1, 1.5.5, 1.5.4.1, 1.5.4, 1.5.3.1, 1.5.3, 1.5.2.1, 1.5.2, 1.5.1.3, 1.5.1.2, 1.5.1.1, 1.5.1",https://www.demoopencart.in/subcategoryimage/oc3/index.php?route=product/category&path=34,https://www.demoopencart.in/subcategoryimage/oc3/admin/index.php?route=extension/module/tmd_subcategory,https://www.opencartextensions.in/opencart-modules/subcategory-image-module
